{
  "task_id": "hwpx-core-benchmark-003-evidence-integrity",
  "candidate_id": "current_node_xml",
  "candidate_role": "editor",
  "scenario_id": "S09",
  "status_reason": "S09 is outside editor responsibility",
  "evidence_completeness": "not_applicable",
  "missing_evidence": [],
  "planned_commands": [
    "Task 003 current_node_xml S09 local evidence execution"
  ],
  "attempted_commands": [],
  "validator_results": [],
  "status": "not_applicable",
  "rationale": "S09 is not assigned to editor in the v6 role matrix",
  "governing_role_matrix_reference": "role-matrix:v6-canonical-output-alignment"
}
