{
  "task_id": "hwpx-core-benchmark-003-evidence-integrity",
  "candidate_id": "hancom_com",
  "candidate_role": "layout_authority",
  "scenario_id": "S03",
  "status_reason": "S03 is outside layout_authority responsibility",
  "evidence_completeness": "not_applicable",
  "missing_evidence": [],
  "planned_commands": [
    "Task 003 hancom_com S03 local evidence execution"
  ],
  "attempted_commands": [],
  "validator_results": [],
  "status": "not_applicable",
  "rationale": "S03 is not assigned to layout_authority in the v6 role matrix",
  "governing_role_matrix_reference": "role-matrix:v6-canonical-output-alignment"
}
